{
  "task_id": "TASK-131",
  "title": "v11.0 proof: read-only GitHub observation selects the next task",
  "description": "Use AOF runtime plus read-only GitHub observation to inspect issues, PRs, releases, actions, README, and docs, then select one next most important task with evidence and Go/No-Go.",
  "status": "done",
  "origin": "orchestrator",
  "orchestrator_session_id": "SESS-V110-GITHUB-OBSERVATION-PROOF",
  "assigned_session_ids": [
    "SESS-V110-GITHUB-OBSERVATION-PROOF"
  ],
  "related_decision_record_id": null,
  "operating_goal_ref": "v11.0-github-observation-proof",
  "created_at": "2026-08-13T13:22:35.162Z",
  "updated_at": "2026-08-13T15:14:11.565Z",
  "assigned_at": null,
  "done_at": "2026-08-13T15:14:11.565Z",
  "retired_at": null,
  "last_triaged_at": null,
  "stale_candidate_at": null,
  "retire_candidate_at": null,
  "triage_notes": "External writes are not authorized. GitHub observation is read-only only."
}
