{
  "task_id": "TASK-116",
  "title": "Ship v9.6 Provider Execution Cost and Quota Boundary",
  "description": "Create provider execution cost and quota boundary evidence so AOF can block or escalate provider-backed execution when estimated cost, token usage, API quota, rate limit, budget owner, or billing uncertainty exceeds declared limits.",
  "status": "done",
  "origin": "orchestrator",
  "orchestrator_session_id": "SESS-V96-COST-QUOTA",
  "assigned_session_ids": [],
  "related_decision_record_id": null,
  "operating_goal_ref": null,
  "created_at": "2026-07-24T01:32:38.164Z",
  "updated_at": "2026-07-24T01:54:57.317Z",
  "assigned_at": null,
  "done_at": "2026-07-24T01:54:57.317Z",
  "retired_at": null,
  "last_triaged_at": null,
  "stale_candidate_at": null,
  "retire_candidate_at": null,
  "triage_notes": "v9.6 provider execution cost/quota boundary implemented with runtime commands, schemas, product capability evidence, capability delta, Mission Control projection, maker/checker/council evidence, and focused tests."
}
