{
  "task_id": "TASK-109",
  "title": "Ship v8.9 External Runtime Outcome Evidence and Learning Loop",
  "description": "Define and verify external runtime outcome evidence and learning-loop update contracts after approved, reproduced, and rollback-ready provider actions.",
  "status": "done",
  "origin": "orchestrator",
  "orchestrator_session_id": "SESS-V89-OUTCOME-LEARNING",
  "assigned_session_ids": [
    "SESS-V89-OUTCOME-LEARNING"
  ],
  "related_decision_record_id": "DEC-V89-OUTCOME-LEARNING",
  "operating_goal_ref": ".aof/goals/operating-goal.json",
  "created_at": "2026-07-20T14:58:46.594Z",
  "updated_at": "2026-07-20T15:20:46.555Z",
  "assigned_at": null,
  "done_at": "2026-07-20T15:20:46.555Z",
  "retired_at": null,
  "last_triaged_at": null,
  "stale_candidate_at": null,
  "retire_candidate_at": null,
  "triage_notes": "v8.9 runtime proof, outcome evidence audit, learning-loop audit, Council review, release docs, and release gates completed."
}
