{
  "task_id": "TASK-138",
  "title": "v11.7 proof: provider read decision replay in Mission Control",
  "description": "Project provider read decision replay and external operator feedback status into Mission Control so operators can see decision state, feedback route, evidence links, and not-proven boundaries without opening raw artifacts.",
  "status": "done",
  "origin": "orchestrator",
  "orchestrator_session_id": "SESS-V117-PROVIDER-READ-DECISION-REPLAY",
  "assigned_session_ids": [
    "SESS-V117-PROVIDER-READ-DECISION-REPLAY"
  ],
  "related_decision_record_id": null,
  "operating_goal_ref": ".aof/goals/operating-goal.json",
  "created_at": "2026-08-19T01:33:29.772Z",
  "updated_at": "2026-08-19T01:45:03.689Z",
  "assigned_at": null,
  "done_at": "2026-08-19T01:45:03.689Z",
  "retired_at": null,
  "last_triaged_at": null,
  "stale_candidate_at": null,
  "retire_candidate_at": null,
  "triage_notes": "v11.7 implemented provider-read decision replay audit, Mission Control projection, release docs, product evidence, capability delta, and release-state integration."
}
