{
  "task_id": "TASK-058",
  "title": "Add Work Governance schemas and fixtures",
  "description": "Add minimal schema surface and software/non-software fixtures for governed work items: work-item-goal, actor-composition, council-ready-output, go-no-go-visualization, operational-map-change-log, context-pack, and external-ref.",
  "status": "done",
  "origin": "orchestrator",
  "orchestrator_session_id": "SESS-WORK-GOVERNANCE-V61",
  "assigned_session_ids": [
    "SESS-WORK-GOVERNANCE-V61"
  ],
  "related_decision_record_id": "CRP-TASK-058-WORK-GOVERNANCE-SCHEMAS",
  "operating_goal_ref": "v6.1-work-governance",
  "created_at": "2026-06-23T12:17:51.707Z",
  "updated_at": "2026-06-23T12:31:05.145Z",
  "assigned_at": "2026-06-23T12:19:24.187Z",
  "done_at": "2026-06-23T12:31:05.145Z",
  "retired_at": null,
  "last_triaged_at": null,
  "stale_candidate_at": null,
  "retire_candidate_at": null,
  "triage_notes": "Completed Work Governance schema/fixture slice. Added schemas, software/manufacturing fixtures, tests, and fixed assigned-task frontier selection. npm test green."
}
